{
  "$schema": "https://json-schema.org/draft/2020-12/schema",
  "$id": "https://lnhgames.dev/lnh-prism/schemas/analysis-receipt/1.0",
  "title": "LNH Prism Analysis Receipt",
  "type": "object",
  "additionalProperties": false,
  "required": ["schemaVersion", "id", "version", "status", "concept", "createdAt", "analyzer", "proposals"],
  "properties": {
    "schemaVersion": { "const": "1.0" },
    "id": { "$ref": "#/$defs/id" },
    "version": { "$ref": "#/$defs/semver" },
    "status": { "enum": ["draft", "reviewed", "superseded"] },
    "concept": {
      "type": "object",
      "additionalProperties": false,
      "required": ["receiptId", "sha256"],
      "properties": {
        "receiptId": { "$ref": "#/$defs/id" },
        "sha256": { "$ref": "#/$defs/sha256" }
      }
    },
    "createdAt": { "type": "string", "format": "date-time" },
    "analyzer": {
      "type": "object",
      "additionalProperties": false,
      "required": ["type", "tool"],
      "properties": {
        "type": { "enum": ["ai-assisted", "human"] },
        "tool": { "type": "string", "minLength": 1 },
        "settings": { "type": "string", "minLength": 1 }
      },
      "allOf": [
        {
          "if": { "properties": { "type": { "const": "ai-assisted" } }, "required": ["type"] },
          "then": { "properties": { "settings": {} }, "required": ["settings"] }
        }
      ]
    },
    "proposals": {
      "type": "array",
      "minItems": 1,
      "items": { "$ref": "#/$defs/proposal" }
    }
  },
  "$defs": {
    "id": { "type": "string", "pattern": "^[a-z][a-z0-9-]{2,62}$" },
    "semver": { "type": "string", "pattern": "^(0|[1-9][0-9]*)\\.(0|[1-9][0-9]*)\\.(0|[1-9][0-9]*)(-[0-9A-Za-z.-]+)?(\\+[0-9A-Za-z.-]+)?$" },
    "sha256": { "type": "string", "pattern": "^[a-f0-9]{64}$" },
    "region": {
      "type": "object",
      "additionalProperties": false,
      "required": ["x", "y", "width", "height"],
      "properties": {
        "x": { "type": "number", "minimum": 0, "maximum": 1 },
        "y": { "type": "number", "minimum": 0, "maximum": 1 },
        "width": { "type": "number", "exclusiveMinimum": 0, "maximum": 1 },
        "height": { "type": "number", "exclusiveMinimum": 0, "maximum": 1 }
      }
    },
    "evidence": {
      "oneOf": [
        {
          "type": "object",
          "additionalProperties": false,
          "required": ["type", "conceptSha256", "region"],
          "properties": {
            "type": { "const": "source-region" },
            "conceptSha256": { "$ref": "#/$defs/sha256" },
            "region": { "$ref": "#/$defs/region" },
            "note": { "type": "string", "minLength": 1 }
          }
        },
        {
          "type": "object",
          "additionalProperties": false,
          "required": ["type", "statement"],
          "properties": {
            "type": { "const": "verbal" },
            "statement": { "type": "string", "minLength": 1 }
          }
        }
      ]
    },
    "proposal": {
      "type": "object",
      "additionalProperties": false,
      "required": ["proposalId", "category", "observation", "recommendation", "evidence", "confidence", "critical", "disposition"],
      "properties": {
        "proposalId": { "$ref": "#/$defs/id" },
        "category": { "enum": ["palette", "spacing", "shape", "stroke", "lighting", "material", "hierarchy", "component-tree"] },
        "observation": { "type": "string", "minLength": 1 },
        "recommendation": {
          "oneOf": [
            { "type": "null" },
            {
              "type": "object",
              "additionalProperties": false,
              "required": ["targetPath", "value"],
              "properties": {
                "targetPath": { "type": "string", "pattern": "^/" },
                "value": true,
                "rationale": { "type": "string", "minLength": 1 }
              }
            }
          ]
        },
        "evidence": { "type": "array", "minItems": 1, "items": { "$ref": "#/$defs/evidence" } },
        "confidence": { "enum": ["high", "medium", "low"] },
        "critical": { "type": "boolean" },
        "disposition": { "enum": ["pending", "accepted", "edited", "rejected", "unresolved"] },
        "reviewerNote": { "type": "string", "minLength": 1 }
      },
      "allOf": [
        {
          "if": { "properties": { "disposition": { "enum": ["edited", "rejected"] } }, "required": ["disposition"] },
          "then": { "properties": { "reviewerNote": {} }, "required": ["reviewerNote"] }
        },
        {
          "if": {
            "properties": { "critical": { "const": true }, "disposition": { "const": "unresolved" } },
            "required": ["critical", "disposition"]
          },
          "then": { "properties": { "reviewerNote": {} }, "required": ["reviewerNote"] }
        }
      ]
    }
  }
}
